{
  "schema_version": "1.0",
  "capability_name": "example-capability",
  "declared_readiness": "needs_seed_cases",
  "cases": {
    "seed": [],
    "golden": [],
    "failure": []
  },
  "baseline": {
    "human_approved": false,
    "evidence_refs": []
  },
  "regression": {
    "threshold_configured": false,
    "minimum_pass_rate": null
  }
}
